[
  {
    "num": 0,
    "name": "The Fool",
    "slug": "the-fool",
    "paragraphs": [
      "Seat yourself comfortably in a chair that will hold your back upright. Place Tarot Key 0, The Fool, in front of you. Look at it quietly for five minutes, meanwhile breathing deeply and rhythmically.",
      "Close your eyes and continue your deep rhythmic breathing to the end of the practice. See yourself as being immersed in a pale yellow light, permeating every atom of your body, radiating out to approximately two feet from your body in every direction. This visualization should take the form of an oval. While holding yourself immersed in the pale yellow light, picture Tarot Key 0 as being above you in full three-dimensional imagery.",
      "Mentally draw the Fool downward into your oval of light. Now see yourself as being the Tarot key in all its details, including the colors. Try to experience yourself as a three dimensional representation of The Fool. Mentally enter into the position of the Fool, standing up straight, holding your memory on the staff in a debonair, light manner, full of the joy of the heights already attained. Now look up and out with a sense of wonder and adventure towards the next height to be scaled. Feel the jaunty feather on your head, experience the glow of the white sun energizing you. Be aware of your cloak of experience symbolizing the riches you carry with you from yesterday into tomorrow. Reach for the joyous expectation of wondrous experience to come."
    ],
    "affirmation": "\"I am the adventure of life. I am eternal youth. I have come from the previous valleys of yesterday to the invigorating heights of today. I am the eternal traveler, journeying into the miracle of self-discovery. I climb gaily from height to height. Never a time I was not; never a time I will not be. I am sure of foot, adventuring with laughter. I am the flame of livingness; the security of attainment is my destiny.\""
  },
  {
    "num": 1,
    "name": "The Magician",
    "slug": "the-magician",
    "paragraphs": [
      "(This exercise should be done each morning upon arising) Place Tarot Key No. 1, The Magician, before you. Sit with back straight in a comfortable chair and concentrate on The Magician while you are doing deep, rhythmic, breathing for approximately five minutes. Close your eyes and imagine yourself immersed in a yellow light, slightly darker yellow than The Fool. See this light as extending two feet beyond your body into the aura in all directions.",
      "Picture the Magician above your head, life size. Now mentally draw the image of the Magician down into your aura. By an act of will and deliberate attention become this Tarot Key. See yourself reaching upward, holding the staff with your right hand.",
      "You are opening yourself to the Divine Will. Notice your left hand pointing downward to charge the garden of your subconsciousness with the transmuting power of the Above. Note the materials on your table. Inhale the fragrance of the roses. See the figure 8 above your head, symbol of eternity."
    ],
    "affirmation": "I am a self-conscious center of the Most High. I am the magic of awareness. I am the miracle of attention. I am the unique way through which the Lord of Life lives Itself. I am a specialized expression of the Eternal Life of the Universe. Mine are the senses through which the here and now becomes an experienced Reality. I dedicate this attention of mine to the use of my Higher Soul. This day I reach to the Higher to help me give more complete attention to the life and forms, to the sights and sounds, and to the experiences I eagerly go forth to meet. Thus do I learn to live the larger consciousness, by partaking of each instant with fullness."
  },
  {
    "num": 2,
    "name": "The High Priestess",
    "slug": "high-priestess",
    "paragraphs": [
      "While comfortably seated, look at the High Priestess. Breathe deeply and rhythmically. Immerse yourself in an oval of blue. Visualize the High Priestess above you full size and in full color. Mentally direct the High Priestess into you. Now enter into the spirit of this Key--become this key.",
      "Notice the flow of water from the lap of your robe. Visualize it as sparkling blue water. Mentally direct this fluidic substance of your subconsciousness in a clockwise direction, whirling round and round the outer edges of your aura, approximately one foot wide. Now image The Magician above you in full life size and three dimensions. After whirling the water clockwise seven times, with a quick act of will stop the motion. Notice the scroll you hold in your hand--the scroll of your memory-record of your past reaching back into and before time began. Notice your poise, stillness and balance as you sit between the white and black pillars. Pay attention to the veil behind you. Again, notice the flow of sparkling blue water from the lap of your robe, coruscating down to your feet. Take this flow of water mentally, turn it counterclockwise upwards to the top of your High Priestess selfhood. Continue it upwards, and like a fountain let it spray the garden of The Magician in the Tarot Key above your head. From the center of this fountain that is watering the Magician's garden, direct a jet stream upwards till it is over the head of The Magician; then let it wash gently over the Magician in streams of peaceful blue like a gentle rain"
    ],
    "affirmation": "I am an eternal selfhood living within the ocean of life. I gather the knowledge from the universal subconsciousness as I require it. I return to this ocean of subconsciousness my own experiences, adding to the treasures of God, thereby. Within me is the knowledge of the unity of life; within me is the power of rapport. I give up and hand over to the Higher Self, which is in charge of my eternal selfconsciousness, the control of the subconscious substance of me. No more need I react blindly or unconsciously to the forces of strife. I can now walk in peace-live in serenity. The transmutation of my essence is assured."
  },
  {
    "num": 3,
    "name": "The Empress",
    "slug": "the-empress",
    "paragraphs": [
      "Green, Emerald green, is the color of Venus, the throat center. It is the throat center which rules the other Chakras. It is only when the throat center is well-charged with electromagnetic energy that we are able to begin to control our emotional nature properly.",
      "Feel yourself permeated with green, vibrating, pulsing color. Image the figure of the Empress as being above your head. Look well at the various colors, especially the wheat and the water. Picture the Key above your head as the cosmic female aspect of God. Then look at the wheat and the earth from which it grows. Mentally choose a definite creative thought, something you wish to be in terms of your personality. Have the Empress take this seed and plant it in the earth. Have her bring a trickle of the water from the pool to water it. Remember that that stream is the substance of your universal consciousness.",
      "Hold the feeling that relates you to whatever you want to do in terms of your personality.",
      "Build yourself a flame of green light and release it to subconsciousness to do its work.",
      "Carry out this exercise one or two times each day."
    ],
    "affirmation": "I am a child of Divinity. As a manifested vehicle inherits traits from its generic strain, so do I, as child of the Most High, inherit the powers of my cosmic parents. I send you my love, physical mother of mine, for being an aspect of the Divine--for lending your substance to grow me. And thus do I clear the channels for the full and spiritual knowledge of my Divine heredity. Sanctified in the love of thee, Cosmic Mother, let me now awaken to the full knowledge of my wondrous heritage."
  },
  {
    "num": 4,
    "name": "The Emperor",
    "slug": "the-emperor",
    "paragraphs": [
      "Follow the procedures as previously outlined. Immerse yourself in brilliant scarlet red. See Tarot Key 4 above you in full life size and in three dimensions. Notice the Emperor sitting on the cube, symbol of manifestation. Examine the design on the cube.",
      "Note the Emperor's armor. Reason is the shield that protects us from becoming caught up in destructive forces.",
      "The staff of dominion indicates rulership of the reasoning faculty. Watch the flowing river. Send up your love to this symbol of the Cosmic Father. Acknowledge your power of rulership as coming from Him."
    ],
    "affirmation": "I am child of my Heavenly Father. I inherit my gift of vision, both inner and outer, from Him. I am a prince (or princess) learning how to gain dominion over the plot of land my Father has given me, my environment. As I learn, my vision expands into more and more accurate interpretation and reasoning ability. This gives me the power to control and rule circumstances ever more effectively. I thank thee, O physical father, for having been the channel in and through which my Cosmic Father has given me of his Spiritual Seed. Before I was blind, but now I see. I acknowledge myself as child of Deity. How much bluer the sky, how much brighter the hues of life around me as I expand my vision into the Infinite."
  },
  {
    "num": 5,
    "name": "The Hierophant",
    "slug": "the-hierophant",
    "paragraphs": [